"id","created","updated","title","description","priority","investigation_type","event_datetime","completion_due_date","steps_completed","function_location","equipment_description","object_type","catalog_profile","catalog_profiles","object_part_description","damage_code","supervisor_id","event_type","status","total_effective_duration","total_tonnes_lost","date_closed","total_event_duration","cause_code","is_archived","archive_user_id","archive_datetime"
427,2020-09-12 05:18:00.000 +0800,2021-01-06 14:09:02.000 +0800,"6030 Stick cylinder removed due to leak at 11% life; Historical BMS Id: RCA-0000348","EX052 LH stick cylinder installed 14/6/20 identified as leaking from head during inspection on 18/7/20 at ~700 Hrs. No rod damage noticed while in service. Cylinder was removed from service 11/09/20 with 1314 Hrs, of a 12 000 Hr strategy (11% life) Cylinder is serial number STK-0005 previous HCS job number 112935.  Note: Attached CCO form lists serial STK-0004 incorrectly. Correct Serial identified via stamped job number.",Medium,2,2020-09-11 10:00:00.000 +0800,2021-01-06 14:09:02.000 +0800,5,SOL-MP-EXCV-EX052 -HYDSYS-HDCYL-STCLL,Cylinder Stick LH,Hydraulic Cylinder,MP-HDCYL,'{}',,,4740,1,3,0.0,0.0,2021-01-06 14:09:02.000 +0800,,,,,
428,2021-04-10 09:19:00.000 +0800,2021-07-05 11:14:30.000 +0800,EX003 Left track frame structural failure; Historical BMS Id: RCA-0000427,"On 24/3/2021 , Considerable damage was sustained to EX003 's track tension cylinder mount, likely due to an accidental impact., The subsequent repair has also been damaged on 9/4/2021, Possibly due to another impact or adequacy of repair. ",Medium,2,2021-04-09 15:30:00.000 +0800,2021-07-05 11:14:30.000 +0800,5,CLB-MP-EXCV-EX003 -STRUCT-TKFRL,Track Frame LH,Structural Frame,MP-TKFRM,'{}',,,4740,1,3,0.0,0.0,2021-07-05 11:14:30.000 +0800,,,,,
429,2021-06-18 14:24:00.000 +0800,2021-09-02 17:06:48.000 +0800,WL261 Top Artic Pin Failed ; Historical BMS Id: RCA-0000461,"Artic was reported to be making squeaky sounds and excessive movements. Upon diagnosis the top bearing retainer bolts have come loose causing excessive horizontal movement. Machine had MCORS coming up, greased the pin and tighten the bolts as interim measures and task was appended onto MCORS scope. ",Medium,2,2021-05-05 03:51:00.000 +0800,2021-09-02 17:06:48.000 +0800,5,CCK-MP-LOAD-WL261 -STRUCT-CHASS-ARTIC,Chassis Articulation,Articulation Hitch,MP-ARTIC,'{}',,,5970,1,3,55.0,0.0,2021-09-02 17:06:48.000 +0800,,,,,
430,2021-10-26 11:18:00.000 +0800,2021-10-26 12:58:11.000 +0800,EX232 Engine premature failure at 3305hrs (20.7% life); Historical BMS Id: RCA-0000498,"30/09/2021 14:54 EX232 went into breakdown for low engine oil levels, excessive oil leakage. ",Medium,2,2021-09-30 14:54:00.000 +0800,2021-10-26 12:58:11.000 +0800,5,CCK-MP-EXCV-EX232 -ENGINE,Engine Assembly Cummins CM2150,Engine,MP-ENGIN,'{}',,,10624,1,3,94.0,0.0,2021-10-26 12:58:11.000 +0800,,,,,
437,2022-01-16 09:40:00.000 +0800,2022-04-07 15:18:17.000 +0800,DZ172 Engine Failure; Historical BMS Id: RCA-0000519,"SMU - 46251 Engine SMU - 7852Hrs Machine was in to look into excessive black smoke coming from it. Fitter tried to start the engine and found that it was misfiring on the RHS. Number 10 exhaust valve had dropped which cause internal damage. Upon further investigation, it was found that the camshaft had failed which resulted in the valve bridge to drop and dislodge valve retainer. The valve knocked the piston. Number 10 liner was cracked causing coolant to enter engine sump.",Medium,2,2022-01-14 08:03:00.000 +0800,2022-04-07 15:18:17.000 +0800,5,CCK-MP-DOZR-DZ172 -ENGINE,Engine Assembly Caterpillar C27,Engine,MP-ENGIN,'{}',,,2457,1,3,200.0,0.0,2022-04-07 15:18:17.000 +0800,,,,,
438,2020-09-29 11:08:00.000 +0800,2021-07-04 14:28:57.000 +0800,DT768 - Engine filling the sump with coolant ; Historical BMS Id: RCA-0000353,"VHMS download showed blowby pressure sensor fault, insight confirmed this fault, replaced the sensor, cleaned out the hoses, noticed water coming out of the hoses, checked oil in sump and reserve tan, ok removed LH #4 cyl rocker and inspected under for condensation, it looked good confirmed sensor was working through insight and returned truck back to work  Machine then came back in and Checked engine blow by and found slug build up in breather box and in blow by pressure switch and all connecting pipes.  Cleaned all above components and tested and inspected while running and seen a large amount of condensation coming from the engine breathers. Reported to supervisor and sent back to work to monitor",Medium,2,2020-09-23 11:09:00.000 +0800,2021-07-04 14:28:57.000 +0800,5,CCK-MP-HAUL-DT768 -ENGINE,Engine Assembly Cummins QSK60,Engine,MP-ENGIN,'{}',,,7995,1,3,0.0,0.0,2021-07-04 14:28:57.000 +0800,,,,,
439,2021-05-12 06:37:00.000 +0800,2021-06-04 16:47:07.000 +0800,DT5359 - LH Final drive failure; Historical BMS Id: RCA-0000442,LH Final drive housing destroyed and planetary gear housing fell off. Truck is loaded and halfway up a ramp. ,Medium,1,2021-05-11 06:42:00.000 +0800,2021-06-04 16:47:07.000 +0800,5,CLB-MP-HIRE-DT5359,DT5359 Caterpillar 793C OHT-Pia,Haul Truck,PM-MP,'{}',,,7995,1,3,0.0,0.0,2021-06-04 16:47:07.000 +0800,,,,,
440,2020-12-16 12:08:00.000 +0800,2021-03-12 14:05:52.000 +0800,DT158 LH rod end ball stud failure ; Historical BMS Id: RCA-0000379, Maintenance fitter was called in to investigate coolant leak and found pos 2 ball stud snapped. ,Medium,2,2020-12-11 12:17:00.000 +0800,2021-03-12 14:05:52.000 +0800,5,CCK-MP-HAUL-DT158 -STRSYS-STLTR-LBSP2,Linkage Ball Stud Pos 2 ST,Ball Stud,MP-BSTUD,'{}',,,7995,1,3,0.0,0.0,2021-03-12 14:05:52.000 +0800,,,,,
441,2020-08-28 16:19:00.000 +0800,2020-11-13 10:27:14.000 +0800,DT772 Grid Box Blower Motor RH failure ; Historical BMS Id: RCA-0000336,Blower motor replaced due to brushes worn below minimum spec and have been arcing on the armature,Medium,2,2020-06-19 16:22:00.000 +0800,2020-11-13 10:27:14.000 +0800,5,CCK-MP-HAUL-DT772 -ELCTHV-HVGBM-GBMRH,Grid Box Blower Motor RH,Electrical Motor,MP-MOTOR,'{}',,,7995,1,3,32.0,0.0,2020-11-13 10:27:14.000 +0800,,,,,
442,2020-12-28 12:31:00.000 +0800,2021-08-28 06:45:29.000 +0800,DT098 engine failure; Historical BMS Id: RCA-0000393,"Crankshaft had sized on engine , removed engine oil filter and found evidence of metal contamination on bottom retaining housing, removed old filter and inspected...there were signs of metal contamination. , removed engine oil pan, engine scav pump, inspected engine for cause of damage. Found Number 11 big end journal has failed.",Medium,2,2020-12-25 12:31:00.000 +0800,2021-08-28 06:45:29.000 +0800,5,CCK-MP-HAUL-DT098 -ENGINE,Engine Assembly Caterpillar C175-16,Engine,MP-ENGIN,'{}',,,7995,1,3,0.0,0.0,2021-08-28 06:45:29.000 +0800,,,,,
443,2021-01-27 05:51:00.000 +0800,2021-02-09 15:06:55.000 +0800,"DT130 Turbo failure, failed L/H inner turbo; Historical BMS Id: RCA-0000404",failed L/H inner turbo. Went down for emergency end of shift. High left turbo turbine inlet temp. ,Medium,2,2021-01-26 09:30:00.000 +0800,2021-02-09 15:06:55.000 +0800,5,CCK-MP-HAUL-DT130 -ENGINE-INTEX,Intake and Exhaust System,Exhaust,MP-INTEX,'{}',,,7995,1,3,20.9,0.0,2021-02-09 15:06:55.000 +0800,,,,,
444,2020-09-14 08:01:00.000 +0800,2021-03-11 07:05:21.000 +0800,Failure of the pos 2 king pin as there is extensive damage to the axle assembly and wheel spindle; Historical BMS Id: RCA-0000349,"Pos 2 king pin has extensive damage to the axle assembly and wheel spindle, when the movement checks were carried out it was noticed that 12mm of movement on king pin. ",Medium,2,2020-09-08 17:13:00.000 +0800,2021-03-11 07:05:21.000 +0800,5,CCK-MP-HAUL-DT301 -STRUCT-AXLES-KINGR,Kingpin RH,Kingpin,MP-KGPIN,'{}',,,7995,1,3,168.0,0.0,2021-03-11 07:05:21.000 +0800,,,,,
445,2021-04-24 14:19:00.000 +0800,2022-03-26 12:22:27.000 +0800,DT100 Transmission failure ; Historical BMS Id: RCA-0000433,"DT100 Transmission failure (16688 hrs) Due to clutch material found on the screens on 06.04.21, this component was already under our radar, but it failed earlier than expected. Transmission failure, Position 1 clutch pack failure.     ",Medium,1,2021-04-06 14:21:00.000 +0800,2022-03-26 12:22:27.000 +0800,5,CCK-MP-HAUL-DT100 -TRNSYS-TRANS,Transmission,Transmission,MP-TRANS,'{}',,,7995,1,3,0.0,0.0,2022-03-26 12:22:27.000 +0800,,,,,
446,2021-01-07 14:57:00.000 +0800,2021-03-11 07:05:21.000 +0800,DT090 Engine - Replace; Historical BMS Id: RCA-0000399,"Major failure in the vicinity of #6 cylinder and the lifters/cam followers have broken away from the block, the cam lobes look like scrap metal and the sump is full of coolant.",Medium,2,2020-07-08 15:09:00.000 +0800,2021-03-11 07:05:21.000 +0800,5,CCK-MP-HAUL-DT090 -ENGINE,Engine Assembly Caterpillar C175-16,Engine,MP-ENGIN,'{}',,,7995,1,3,194.0,0.0,2021-03-11 07:05:21.000 +0800,,,,,
447,2020-12-30 09:36:00.000 +0800,2021-04-27 09:06:23.000 +0800,"930E Steering Accumulator Sensor Mod Issues; Historical BMS Id: RCA-0000394","Since installing the digital display setup we have seen an increase of the in the steering accumulator low pressure events and ruptured bladders   DT762 has had its 3rd front accumulator bladder replaced , and is not the only truck we have had issues with.   .    ",Medium,2,2020-12-29 09:37:00.000 +0800,2021-04-27 09:06:23.000 +0800,5,CCK-MP-HAUL-DT762 -STRSYS,Steering System,Steering System,MP-STSYS,'{}',,,7995,1,3,0.0,0.0,2021-04-27 09:06:23.000 +0800,,,,,
448,2020-10-10 07:09:00.000 +0800,2021-01-21 10:30:37.000 +0800,DT127 Failed position 4 ball stud and chassis cracking ; Historical BMS Id: RCA-0000359,DT127-LH Inner Tie Rod Ball Stud Broken,Medium,2,2020-10-09 07:09:00.000 +0800,2021-01-21 10:30:37.000 +0800,5,CCK-MP-HAUL-DT127 -STRSYS-STLTR-LBSP4,Linkage Ball Stud Pos 4 ST,Ball Stud,MP-BSTUD,'{}',,,7995,1,3,0.0,0.0,2021-01-21 10:30:37.000 +0800,,,,,
1012,2022-02-16 08:42:08.000 +0800,2022-03-16 02:21:46.000 +0800,GEHO 525 Failure Investigation; Historical Sharepoint Solomon Id 539,,Medium,1,2022-02-14 16:00:00.000 +0800,,5,SOL-KV-DSND-THICK1-PU525 -ASBLY,Pump Tailings Disposal PU525,Pump,PM-PMP,'{}',,,4331,1,3,2.4,18832.0,2022-08-01 08:00:00.000 +0800,,,,,
450,2020-09-29 07:09:00.000 +0800,2021-03-17 14:06:56.000 +0800,DT091 - Failed transmission ; Historical BMS Id: RCA-0000352,"DT091 Came in with transmission fault, fitters Investigated oil transfer, trans oil to hydraulic tank and trans low level shut down, drained hydraulic oil to level, topped transmission oil, checked pump drive mag plug was ok, ran up to confirm transfer, put it gear and noticed trans slipping in first forward and reverse,",Medium,2,2020-09-22 07:10:00.000 +0800,2021-03-17 14:06:56.000 +0800,5,CCK-MP-HAUL-DT091 -TRNSYS-TRANS,Transmission,Transmission,MP-TRANS,'{}',,,7995,1,3,113.9,0.0,2021-03-17 14:06:56.000 +0800,,,,,
451,2021-06-06 10:25:00.000 +0800,2021-06-24 07:09:01.000 +0800,DT054 Starter motor failure ; Historical BMS Id: RCA-0000455,"Incident: 3 Fitters were maneuvering DT054 into place to align the front hubs to drain the oil. This is part of the service. The truck was required to be moved and one fitter operated the truck. The truck failed to start when the fitter attempted. The team reconvened on the ground and discussed the use of the starter trolley. Two members left the job to find the trolley and the fitter who was operating decided to bleed the fuel pressure because the fuel tank was at 11%. Upon the return of the 2 team members they attempted to start the truck one more time with success. They reconvened at the front of the truck on the ground and saw the sparks coming from beneath the truck. A whining noise was heard above the idle, a definite confirmation the starter motor was stuck in the engaged position. The lower E-stop was pressed and the truck shut down. One person went to grab the wash down hose and started to wet the area of the starter motors, one person isolated the truck, and one person grabbed the fire extinguisher. Once they were satisfied there was no risk of ignition they reported it to the supervisor.  Contributing factors: Current truck SMU 51848 hours. Starter motors changed out at 50733 hours, 10 April 2021. Starter motor stayed engaged when truck was idling.",Medium,2,2021-06-03 10:40:00.000 +0800,2021-06-24 07:09:01.000 +0800,5,CCK-MP-HAUL-DT054 -ENGINE,Engine Assembly Caterpillar C175-16,Engine,MP-ENGIN,'{}',,,7995,1,3,0.0,0.0,2021-06-24 07:09:01.000 +0800,,,,,
452,2020-10-11 07:37:00.000 +0800,2021-01-21 09:05:41.000 +0800,DT768-Steering Charge Faults; Historical BMS Id: RCA-0000361,"DT768 went down with steering charging faults, inspected, tested brake and steering accumulators and found to be low, set all to 1500 psi, sent truck to see how it went, truck went down again, travel back out to truck, Inspected pump pressures to insect cut in and to pressures and standby pressure. Inspected machine and found accumulators to be low, adjusted and sent back to work then went down for the same fault again. Found the steering eh valve to be bypassing at 15psi per second. AHS have been notified. Went and checked accumulator and pump pressures. 1500psi at all 4 accumulators. 3350psi pump pressure. 2750psi flow amp valve steer relief pressure. E-stopped machine and heard bleed down through diverter valve. Handed to AHS to change component as not Komatsu part. Workshop replaced diverter as requested. Completed steering cals. Moved truck off cal pad to allow DT057 to complete a planning checkout. When reversing truck into V-Drain the steering accumulator lights came on. Got Komatsu PSA to help diagnose. Suspected compensator valve to be faulty. Workshop replaced valve. Fault still there. Completed steer bleed down test without autonomy and with autonomy. Found excessive leakage on AHS side. Suspect component in EH valve to be bypassing. Handed over to nightshift to source part and fit. Replaced entire steering EH valve with second hand unit from outside trucks cage, conducted steering cals and planning without fault. Organised service truck to come and fill up hydraulic oil. Replaced a couple 3 pin amp seal connectors at EH valve. Ran around cal pad again. No faults. ",Medium,2,2020-10-07 20:12:00.000 +0800,2021-01-21 09:05:41.000 +0800,5,CCK-MP-HAUL-DT768 -STRSYS,Steering System,Steering System,MP-STSYS,'{}',,,7995,1,3,71.0,0.0,2021-01-21 09:05:41.000 +0800,,,,,
453,2022-03-13 10:02:00.000 +0800,2022-05-27 16:50:47.000 +0800,DT765 Grid box fire; Historical BMS Id: RCA-0000536,"When inspected DT 765 grid blower motor, diffuser assy and the grids the following happened in the order as stated below. 1. Foreign object entered the fan area and all the fan blades broke off 2. The grids over heated with the lack of air flow 3. The diffuser started to warp and melt from the heat to a point where the diffuser touched the grid next to it creating a spark, flash. 4. This created a ground fault that would exit the truck from the propel mode 5. This was logged on VHMS. It lasted 20 seconds 6. The melted, overheated diffuser aluminum caught fire from the spark. 7. The blower motor was still running at this stage and the remaining fan was sucking air over or away from the diffuser fuelling the fire. 8. An attempt was made to put out the fire with 2 x fire extinguisher bottles but due to the angle when sprayed through the small holes in the Gridbox covers the powder was directed away from the fire and could not be effective. 9. With the previous blower motor failure on the same truck the fan motor was seized solid and could not turn thus could not fuel the fire. ",Medium,2,2022-03-07 00:54:00.000 +0800,2022-05-27 16:50:47.000 +0800,5,CCK-MP-HAUL-DT765 -ELCTHV-HVGBM,Grid Box Blower Motor,Electrical Motor,MP-MOTOR,'{}',,,7995,1,3,0.0,0.0,2022-05-27 16:50:47.000 +0800,,,,,
454,2020-12-17 06:26:00.000 +0800,2021-03-17 14:06:56.000 +0800,DT772 HV Alternator failure ; Historical BMS Id: RCA-0000383,"Due to the storms and heavy rain, water entered the blower duct on the 930E and caused a ground fault, upon inspection the sparkies found a burnt alternator bus bar terminal",Medium,2,2020-12-13 06:27:00.000 +0800,2021-03-17 14:06:56.000 +0800,5,CCK-MP-HAUL-DT772 -ELCTHV-HVALT,High Voltage Alternator,Alternator,MP-ALTNR,'{}',,,7995,1,3,157.1,0.0,2021-03-17 14:06:56.000 +0800,,,,,
455,2021-02-12 07:36:00.000 +0800,2021-08-18 16:05:10.000 +0800,DT 761 HV Alternator Failure ; Historical BMS Id: RCA-0000413,"Tray was removed for a tray change out to install a rebuilt tray , while the tray was off the machine was being moved there was heavy rain, with no protection from the tray to the alternator this then allowed water entry to the alternator. ",Medium,2,2021-02-05 07:37:00.000 +0800,2021-08-18 16:05:10.000 +0800,5,CCK-MP-HAUL-DT761 -ELCTHV-HVALT,High Voltage Alternator,Alternator,MP-ALTNR,'{}',,,7995,1,3,147.0,0.0,2021-08-18 16:05:10.000 +0800,,,,,
456,2021-05-11 12:40:00.000 +0800,2021-06-21 11:06:29.000 +0800,Contactor tips latched on and arcd on and caused heat damage to the RP contactor box ; Historical BMS Id: RCA-0000441,"RP Contactor tips have latched on and arc 'd on and caused heat damage to the RP contactor box, the damage from the contactors latched on has blow the GE cards from the current back feeding. ",Medium,2,2021-05-11 02:41:00.000 +0800,2021-06-21 11:06:29.000 +0800,5,CCK-MP-HAUL-DT767 -ELCTHV-HVCAB-CONTR,Contactors,Contactor,MP-CONTR,'{}',,,7995,1,3,0.0,0.0,2021-06-21 11:06:29.000 +0800,,,,,
457,2021-03-12 12:21:00.000 +0800,2021-12-05 10:07:32.000 +0800,DT088 RH Final drive crack ; Historical BMS Id: RCA-0000421,RH final drive was inspected by the machine inspectors and found a crack on the underside of the RH spindle ,Medium,2,2021-03-11 12:21:00.000 +0800,2021-12-05 10:07:32.000 +0800,5,CCK-MP-HAUL-DT088 -FDRSYS,Final Drive System,Final Drive,MP-FDSYS,'{}',,,7995,1,3,0.0,0.0,2021-12-05 10:07:32.000 +0800,,,,,
469,2022-03-13 07:30:00.000 +0800,2022-05-07 10:22:44.000 +0800,DT098 transmission failure causing truck fire; Historical BMS Id: RCA-0000535,"DT098 caught on fire, the truck had failed the transfer case area and the transmission has let go. this has then caused the hot oil to catch on fire, as there is no fire suppression in the transmission area.",Medium,2,2022-03-11 21:31:00.000 +0800,2022-05-07 10:22:44.000 +0800,5,CCK-MP-HAUL-DT098 -TRNSYS-TRANS,Transmission,Transmission,MP-TRANS,'{}',,,7995,1,3,0.0,0.0,2022-05-07 10:22:44.000 +0800,,,,,
458,2020-07-07 11:00:00.000 +0800,2020-11-13 10:27:58.000 +0800,"793F DT161 Fan Motor Leaking Issue ; Historical BMS Id: RCA-0000304",The fan motor from DT161 was removed from the machine on 5/07/2020 with suspected leaking shaft seal Upon investigation main shaft (which is the usual failure mode of the fan motor) does not appear to be leaking as the there is no presence of oil and dirt around the seal area to indicate a leak. ,Medium,2,2020-07-05 11:00:00.000 +0800,2020-11-13 10:27:58.000 +0800,5,CCK-MP-HAUL-DT161 -ENGINE-COSYS-COFAN,Fan Cooling System,Cooling System,MP-FANMT,'{}',,,7995,1,3,0.0,0.0,2020-11-13 10:27:58.000 +0800,,,,,
459,2021-08-13 08:20:00.000 +0800,2021-12-17 13:07:56.000 +0800,LL002 Engine failure ; Historical BMS Id: RCA-0000477,"Diagnosed 1 starter on the machine burnt out ( lower starter coil burnt out) both starters replaced. Tested with 2 new starters, started fine and tested current draw to starters top 490A lower 430A within spec. Handed over to the float crew, float crew called back saying smoke from the truck after 1 start returned to top bottom starters burnt out and hot after 1 start.   Tried to turned engine by hand to make sure wasn 't hydraulic 'd, removed top starters, installed new starters, checked starters relays before starting, checked unknow smoke from the truck.   Cut open the engine oil filters & found metal and removed LHS engine block cover plates & found large sliver of heavy material, likely from big end from main bearings around cylinders 4,5 or 6 due to location of sliver in the sump",Medium,2,2021-08-11 01:08:00.000 +0800,2021-12-17 13:07:56.000 +0800,5,CCK-MP-SUPP,Unknown,Unknown,PMGENERAL,'{}',,,7995,1,3,0.0,0.0,2021-12-17 13:07:56.000 +0800,,,,,
460,2020-12-17 05:48:00.000 +0800,2021-12-20 08:06:42.000 +0800,DT753 Alternator failure ; Historical BMS Id: RCA-0000382,Machine went down with a grounding fault after heavy rain got into the blower duct and caused the alternator failure ,Medium,2,2020-12-12 05:57:00.000 +0800,2021-12-20 08:06:42.000 +0800,5,CCK-MP-HAUL-DT753 -ELCTHV-HVALT,High Voltage Alternator,Alternator,MP-ALTNR,'{}',,,7995,1,3,172.0,0.0,2021-12-20 08:06:42.000 +0800,,,,,
461,2020-10-10 12:54:00.000 +0800,2021-03-11 07:05:21.000 +0800,DT146 pos 4 turbo failure ; Historical BMS Id: RCA-0000360,"Fitter went out to DT146 to inspect turbo issue, they found the position 4 turbo had blown ",Medium,2,2020-10-08 14:10:00.000 +0800,2021-03-11 07:05:21.000 +0800,5,CCK-MP-HAUL-DT146 -ENGINE-INTEX-TBOLO,Turbocharger LH Outer,Turbocharger,MP-TBOCG,'{}',,,7995,1,3,13.7,0.0,2021-03-11 07:05:21.000 +0800,,,,,
462,2021-02-04 06:58:00.000 +0800,2021-08-08 09:05:27.000 +0800,DT763 HV Alternator Failure ; Historical BMS Id: RCA-0000406,"Machine stopped due to a Health Event which was a suspected alternator failure, which was making a grinding noise, which was suspected bearing failure. ",Medium,2,2021-01-28 07:02:00.000 +0800,2021-08-08 09:05:27.000 +0800,5,CCK-MP-HAUL-DT763 -ELCTHV-HVALT,High Voltage Alternator,Alternator,MP-ALTNR,'{}',,,7995,1,3,115.0,0.0,2021-08-08 09:05:27.000 +0800,,,,,
463,2021-03-12 06:37:00.000 +0800,2021-12-05 10:07:32.000 +0800,DT099 Final drive Crack ; Historical BMS Id: RCA-0000420,The machine inspectors have identified a crack on the under side of LH rear spindle ,Medium,2,2021-03-12 06:38:00.000 +0800,2021-12-05 10:07:32.000 +0800,5,CCK-MP-HAUL-DT099 -FDRSYS,Final Drive System,Final Drive,MP-FDSYS,'{}',,,7995,1,3,116.0,0.0,2021-12-05 10:07:32.000 +0800,,,,,
464,2022-01-31 06:48:00.000 +0800,2022-05-27 16:49:31.000 +0800,DT058 Pos 1 turbo failure; Historical BMS Id: RCA-0000524, Pos 1 - LH outer turbo failed 8062hrs,Medium,2,2022-01-30 06:49:00.000 +0800,2022-05-27 16:49:31.000 +0800,5,CCK-MP-HAUL-DT058 -ENGINE-INTEX-TBOLO,Turbocharger LH Outer,Turbocharger,MP-TBOCG,'{}',,,7995,1,3,0.0,0.0,2022-05-27 16:49:31.000 +0800,,,,,
465,2021-07-16 15:59:00.000 +0800,2021-12-17 13:07:56.000 +0800,DT752 Engine Failure ; Historical BMS Id: RCA-0000468,"Engine keeps shutting down for low engine oil pressure. Suspect dilution of engine oil as it has a blown head gasket.  SMU - 48714  Engine SMU - 20,185Hrs  Checked engine oil pressure. Was 40psi @ 750rpm and 75psi @ 1935rpm.  Sampled engine oil and coolant   Sent truck from Lefroy to WTA, but it broke down soon after. Didn 't make it.    Low Eng oil pressure warning. Pressure dropping when oil heats up. Sensor was jumping around decided to replace sensor but didn 't rectify issue. Checked coolant tank and ROS tank and found that they were full to the brim and had a lot of pressure behind it. Suspect leaking coolant or fuel into the ENG oil sump. Oil sample taken.    Truck shut down for Eng gathering 17 fault ,found low coolant and fuel topped up ,VHMS download found body up switch constant fault and low eng oil pressure, inspected oil levels ok sent back to work to monitor.    Drained and filled engine oil and send back to workshop    Check on Insite for faults, unable to communicate with Cense ECM. Screen shot done of fault codes logged.    Removed all r/h bank rocker covers to inspect rocker gear/injector. found broken valve bridge on no 2 inlet valve and also a severely bent push rod.    Removed cam followers and inspected them all appears ok and also checked cam lobes all ok also. job is being referred to cummins for further investigation. email was sent by Rob G to detail all work done so far to ",Medium,2,2021-07-07 16:00:00.000 +0800,2021-12-17 13:07:56.000 +0800,5,CCK-MP-HAUL-DT752 -ENGINE,Engine Assembly Cummins QSK60,Engine,MP-ENGIN,'{}',,,7995,1,3,0.0,0.0,2021-12-17 13:07:56.000 +0800,,,,,
466,2020-08-31 17:15:00.000 +0800,2021-03-17 14:06:56.000 +0800,DT126 Position 3 ball stud failure ; Historical BMS Id: RCA-0000340,When caring out the inspections it was noted that there was a crack nearly all the way through the ball stud,Medium,2,2020-08-30 17:20:00.000 +0800,2021-03-17 14:06:56.000 +0800,5,CCK-MP-HAUL-DT126 -STRSYS-STLTR-LBSP3,Linkage Ball Stud Pos 3 ST,Ball Stud,MP-BSTUD,'{}',,,7995,1,3,0.0,0.0,2021-03-17 14:06:56.000 +0800,,,,,
467,2022-04-07 08:06:00.000 +0800,2022-04-07 12:26:16.000 +0800,DT130 Engine failure ; Historical BMS Id: RCA-0000537,"From initial inspection of the engine it looks like the engine has been dusted, could not identify a fault with just one cylinder. INJ cut-out tests were all the same, and the exhaust temps were the same.     After changing the filter last night, it went down 2hr later. The engine oil needed to be filled up twice to be able to get it back to the workshop.   ",Medium,2,2022-04-03 10:42:00.000 +0800,2022-04-07 12:26:16.000 +0800,5,CCK-MP-HAUL-DT130 -ENGINE,Engine Assembly Caterpillar C175-16,Engine,MP-ENGIN,'{}',,,7995,1,3,0.0,0.0,2022-04-07 12:26:16.000 +0800,,,,,
