"id","created","updated","title","description","priority","investigation_type","event_datetime","completion_due_date","steps_completed","function_location","equipment_description","object_type","catalog_profile","catalog_profiles","object_part_description","damage_code","supervisor_id","event_type","status","total_effective_duration","total_tonnes_lost","date_closed","total_event_duration","cause_code","is_archived","archive_user_id","archive_datetime"
186,2021-09-14 10:12:00.000 +0800,2022-04-06 08:19:14.000 +0800,DR3113- Maspro Trial Rotary Head Failure; Historical BMS Id: RCA-0000489,On 11/09/2021 at around 08:21 DR3113 lost rotation and further investigations concluded that the rotary head has failed internally. This was a Trial Rotary head from Maspro which had a hardened adaptor to allow force transfer to the casing once the gear and camp move sufficiently on the spindle under extreme shock. It also had a bearing retaining ring instead of the bearing locating surface. The rotation unit was Trailed( CR-11634) in SM due to the Increase number of rotary head failures in Solomon. The Rotary head has achieved only 725 hours. ,Medium,2,2021-09-11 08:31:00.000 +0800,2022-04-06 08:19:14.000 +0800,5,SOL-MP-DRLL-DR3113-STRUCT-BOOMS-PWRHD,Gearbox Power Head,Gearbox,MP-GBXPH,'{}',,,12776,1,3,12.0,0.0,2022-04-06 08:19:14.000 +0800,,,,,
526,2018-03-28 01:03:04.000 +0800,2018-07-27 05:27:50.000 +0800,CRC301 Hold Down Bolt Failure; Historical Sharepoint Solomon Id 17,,Medium,3,2018-03-03 16:00:00.000 +0800,,5,SOL-KV-CRSH-CRUSH1-CRC301-ASBLY,Structure Cone Crusher CRC301,Crusher – Cone,PM-STRC,'{}',,,14157,1,3,0.0,0.0,2022-08-01 08:00:00.000 +0800,,,,,
528,2018-03-28 01:40:07.000 +0800,2018-05-02 04:35:19.000 +0800,CRC363 FT Crusher Mainframe Liner; Historical Sharepoint Solomon Id 19,,Medium,3,2018-03-07 16:00:00.000 +0800,,5,SOL-FT-CRSH-CRUSH3-CRC363-ASBLY,Structure Cone Crusher CRC363,Crusher – Cone,PM-STRC,'{}',,,14152,1,3,0.0,0.0,2022-08-01 08:00:00.000 +0800,,,,,
529,2018-03-28 01:40:40.000 +0800,2018-09-01 03:23:00.000 +0800,SN203 Jack shaft failure; Historical Sharepoint Solomon Id 20,,Medium,2,2018-03-12 16:00:00.000 +0800,,5,SOL-KV-WSCR-SCRUB3-SN203 -DRIV1,Exciter DE Wet Screen Drive SN203-EX01,Exciter,PM-EXTR,'{}',,,14184,1,3,0.0,0.0,2022-08-01 08:00:00.000 +0800,,,,,
193,2021-09-14 09:38:00.000 +0800,2022-05-31 15:36:23.000 +0800,EX8103 PP1 Pos 2 Turbo Failure; Historical BMS Id: RCA-0000488,On 12/09/2021 at around 02:08 EX8103 failed PP1 pos2 turbo. The turbo was replaced with the engine module ( Cummins rebuilt the module in Perth ) on 24/06/2021 Work Order 201841242 ( during Shut). As of 10/09/2021 component had only 1215 hours on it. Maintenance contacted Cummins once the component failed and brought back failed part to Trinity shut pad to be sent to Cummins for further investigations. On 14/09/2021 Cummins representative Tash visited Trinity Shut Pad and gathered the information required for further investigations. Cummins to pick up the part from the trinity shut pad and sent it back to Perth. ,Medium,2,2021-09-12 02:08:00.000 +0800,2022-05-31 15:36:23.000 +0800,5,SOL-MP-EXCV-EX8103-FRENGN-ENGIN-TBOP2,Turbocharger Front Pos 2,Turbocharger,MP-TBOCG,'{}',,,9974,1,3,0.0,0.0,2022-05-31 15:36:23.000 +0800,,,,,
194,2022-01-20 14:13:00.000 +0800,2022-06-10 09:21:58.000 +0800,DR3122 LHS Feed Dump Cylinder - Clevis Failure; Historical BMS Id: RCA-0000523,LH Dump cylinder clevis snapped and came off the pin.,Medium,2,2022-01-17 12:41:00.000 +0800,2022-06-10 09:21:58.000 +0800,5,SOL-MP-DRLL-DR3122-HYDSYS-HDCYL-FDDCL,Cylinder Feed Dump LH,Hydraulic Cylinder,MP-HDCYL,'{}',,,9974,1,3,18.75,0.0,2022-06-10 09:21:58.000 +0800,,,,,
533,2018-03-28 06:48:20.000 +0800,2018-03-28 06:48:20.000 +0800,FR503 Filter Belt Fan Fault; Historical Sharepoint Solomon Id 24,,Medium,1,2018-02-13 16:00:00.000 +0800,,5,SOL-KV-DSND-DESND2-FR502 -FAN01,Motor Elect Belt Support Fan 1 FR502,Electrical Motor,PM-MTRS,'{}',,,14184,1,3,0.0,0.0,2022-08-01 08:00:00.000 +0800,,,,,
534,2018-03-29 01:33:58.000 +0800,2018-03-29 01:36:06.000 +0800,FR501 Spray Bar Failure; Historical Sharepoint Solomon Id 25,,Medium,3,2018-03-26 16:00:00.000 +0800,,5,SOL-KV-DSND-DESND1-FR501 -ASBLY,Spray Water FR501 - Discharge End,Spray,PM-SYCN,'{}',,,14184,1,3,0.0,0.0,2022-08-01 08:00:00.000 +0800,,,,,
536,2018-04-04 08:56:43.000 +0800,2019-05-21 23:26:30.000 +0800,SK802 Systems Overview Workshop; Historical Sharepoint Solomon Id 27,,Medium,3,2018-04-03 16:00:00.000 +0800,,5,SOL-SY-STKG-STK802-SK802 -ASBLY,Structure Stacker SK802,Stacker,PM-STRC,'{}',,,14090,1,3,0.0,0.0,2022-08-01 08:00:00.000 +0800,,,,,
538,2018-04-06 02:44:46.000 +0800,2018-05-04 08:21:27.000 +0800,SK801 Bogie Wheel Motor Damage; Historical Sharepoint Solomon Id 29,,Medium,3,2018-04-05 16:00:00.000 +0800,,5,SOL-SY-STKG-STK801-LT801A-ASBLY,Bogie Dual Wheel 15 East SK801,Bogie,PMGENERAL,'{}',,,14152,1,3,0.0,0.0,2022-08-01 08:00:00.000 +0800,,,,,
546,2018-04-13 05:11:25.000 +0800,2018-04-13 05:12:06.000 +0800,FR503 extended downtime for new type of cloth replacement; Historical Sharepoint Solomon Id 37,,Medium,3,2017-01-12 16:00:00.000 +0800,,5,SOL-KV-DSND-DESND2-FR502 -ASBLY,Cloth Filter FR502,Filter,PM-FILT,'{}',,,14170,1,3,0.0,0.0,2022-08-01 08:00:00.000 +0800,,,,,
547,2018-04-13 05:11:25.000 +0800,2018-04-13 05:12:09.000 +0800,CV705 downtime due to Brake 2 faults; Historical Sharepoint Solomon Id 38,,Medium,3,2017-01-14 16:00:00.000 +0800,,5,SOL-KV-CNVY-CONVEY-CV705 -DRIV2,Motor Electric Drive 2 CV705,Electrical Motor,PM-MTRS,'{}',,,14170,1,3,0.0,0.0,2022-08-01 08:00:00.000 +0800,,,,,
548,2018-04-13 05:11:26.000 +0800,2018-04-13 05:12:11.000 +0800,"FR501 Failure, Pl refer to RCA 17030; Historical Sharepoint Solomon Id 39",,Medium,2,2017-01-16 16:00:00.000 +0800,,5,SOL-KV-DSND-DESND1-FR501 -ASBLY,Cloth Filter FR501,Filter,PM-FILT,'{}',,,14090,1,3,0.0,0.0,2022-08-01 08:00:00.000 +0800,,,,,
550,2018-04-13 05:11:27.000 +0800,2018-04-19 02:04:57.000 +0800,TSF Burst Disc Failure; Historical Sharepoint Solomon Id 41,,Medium,2,2017-01-18 16:00:00.000 +0800,,5,SOL-FT,Unknown,Unknown,PMGENERAL,'{}',,,14090,1,3,0.0,0.0,2022-08-01 08:00:00.000 +0800,,,,,
553,2018-04-13 05:13:39.000 +0800,2018-04-13 05:13:39.000 +0800,CV706 MCC Aircon Failure; Historical Sharepoint Solomon Id 44,,Medium,3,2017-01-31 16:00:00.000 +0800,,5,SOL-KV-CNVY-CONVEY-CV706 -EICON,Electrical Field Devices CV706,Electrical System,PMGENERAL,'{}',,,14137,1,3,0.0,0.0,2022-08-01 08:00:00.000 +0800,,,,,
557,2018-04-13 05:13:40.000 +0800,2018-04-13 05:13:40.000 +0800,CV705 extended downtime; Historical Sharepoint Solomon Id 48,,Medium,3,2017-02-12 16:00:00.000 +0800,,5,SOL-KV-CNVY-CONVEY-CV705 -ASBLY,Structure Conveyor CV705,Conveyor,PM-STRC,'{}',,,14170,1,3,0.0,0.0,2022-08-01 08:00:00.000 +0800,,,,,
1270,2022-03-20 02:49:38.000 +0800,2022-10-21 14:38:08.453 +0800,"30PP03A Drive Pulley Belt Failure",RCA136- 30PP03A Drive Pulley Belt Failure Historical Sharepoint CC Id 136,Medium,2,2022-03-17 16:00:00.000 +0800,2022-10-28 00:00:00.000 +0800,5,CCK-P1-DSND-DESND2-PP103A-ASBLY,Pump Warman 6/4 D-AH 30PP03A,Pump,PM-PMP,'{}',Belt,Broken,14144,1,3,2.0,7500.0,2022-08-01 08:00:00.000 +0800,,,,,
1280,2022-05-17 03:00:13.000 +0800,2022-10-26 15:19:46.715 +0800,OPF 2 GEHO Common Discharge Tails Line Failure ,"RCA-145 OPF 2 GEHO Common Discharge Tails Line Failure  
Historical Sharepoint CC Id 146",Medium,2,2022-05-14 16:00:00.000 +0800,2022-10-28 00:00:00.000 +0800,5,CCK-P2-DSND-TAILNG-PPVLV -ASBLY,Piping CC-P2 Tails Discharge to TSF,Piping,PM-PIPI,'{}',Piping,"Broken (Cracked,Leaking,Holed)",14144,1,3,14.7,55125.0,2022-08-01 08:00:00.000 +0800,,Normal Wear and Tear,,,
449,2020-12-02 08:15:00.000 +0800,2021-07-04 15:06:57.000 +0800,DT147 Failed P3 RH Cylinder barrel; end ball stud ; Historical BMS Id: RCA-0000377,Truck was being moved across the yard when it was noticed the the P3 RH Cylinder barrel; end ball stud had failed,Medium,2,2020-12-02 08:16:00.000 +0800,2021-07-04 15:06:57.000 +0800,5,CCK-MP-HAUL-DT147 -STRSYS-STRCY,Cylinders Steering,Hydraulic Cylinder,MP-HDCYL,'{}',,,7995,1,3,0.0,0.0,2021-07-04 15:06:57.000 +0800,,,,,
1263,2022-01-24 08:40:18.000 +0800,2022-10-21 15:33:24.282 +0800,"15CS206 Tripper Wheel Failure ","RCA-129 - 15CS206 Tripper Wheel Failure Historical Sharepoint CC Id 129

Duplicate of RCA 113 before preventative actions could be completed. The engineering team is confident RCA-113 will eminate the root casue. No investigation required. ",Medium,2,2022-01-15 16:00:00.000 +0800,2022-10-28 00:00:00.000 +0800,1,CCK-P2-DSCR-CONV15-CS206 -ASBLY,Drive Tripper L/H 15CS206,Drive,PMGENERAL,"'{""PM-STRC"",""PM-MTRS"",""PMGENERAL"",""PM-SDS"",""PM-FILT"",""PM-CONV"",""PM-SAMP"",""PM-BRGSL"",""PM-VSD"",""MP-TPDRV"",""PM-WTRS"",""PM-FDR"",""MP-FDRVE"",""PM-ELCO"",""MP-DRSHT"",""MP-DRTRN"",""MP-SPRKT"",""PM-DRSHT"",""MP-HDMTR"",""PM-CRNE"",""PM-PMP"",""PM-GEAR"",""PM-PWPK"",""PM-CRSH""}'",Drive Wheels,Failed,8358,1,3,3.5,11700.0,2022-08-01 08:00:00.000 +0800,,,,,
559,2018-04-13 05:13:54.000 +0800,2018-04-19 02:05:32.000 +0800,Quality issues and Lab Downtime; Historical Sharepoint Solomon Id 50,,Medium,3,2017-02-14 16:00:00.000 +0800,,5,SOL-FT,Unknown,Unknown,PMGENERAL,'{}',,,14090,1,3,0.0,0.0,2022-08-01 08:00:00.000 +0800,,,,,
1257,2022-01-11 09:10:16.000 +0800,2022-10-21 15:38:37.838 +0800,GEHO 30PP205A Diaphragm Failure,RCA123-GEHO 30PP205A Diaphragm Failure Historical Sharepoint CC Id 123,Medium,2,2022-01-08 16:00:00.000 +0800,2022-10-28 00:00:00.000 +0800,5,CCK-P2-DSND-TAILNG-PP205A-ASBLY,Pump Assy Power End 30PP205A,Pump,PMGENERAL,"'{""PM-STRC"",""MP-TANKS"",""PM-MTRS"",""MP-OLPMP"",""MP-AUXPP"",""MP-FUTPP"",""MP-WTSPP"",""PMGENERAL"",""MP-RTLPP"",""PM-VSD"",""PM-CONV"",""MP-FUPPP"",""MP-ALPMP"",""PM-WTRS"",""MP-COLAF"",""MP-AIRPP"",""MP-FUIPP"",""PM-VLV"",""PM-PIPI"",""MP-STPMP"",""PM-MP"",""MP-PLUPP"",""PM-BUIL"",""PM-PMP"",""PM-GEAR"",""MP-COLSY"",""MP-WTRPP"",""PM-PWPK"",""PM-EXHST"",""MP-ROIPP"",""MP-LUBEL"",""MP-FUHPP"",""MP-RESOL""}'",Diaphragm,Failed,14144,1,3,0.0,0.0,2022-08-01 08:00:00.000 +0800,,,,,
10609,2022-10-22 07:41:52.839 +0800,2022-10-25 07:32:50.312 +0800,"15CS04 wheel failure ","15CS04 (CV04 tripper) wheel failure, shaft and bearing damages found in Drive E (central one on the LHS)
CC-OPF-RCA-161",Medium,1,2022-10-20 09:16:40.000 +0800,2022-11-19 00:00:00.000 +0800,3,CCK-P1-DSCR-CONV15-CS104 -DRIV1,Tripper Drive R/H 15CS04,Drive,PMGENERAL,'{}',Whole Unit,"Broken (Cracked,Leaking,Holed)",9038,1,1,4.6,25450.5,,9.1,,false,,
1260,2022-01-12 07:23:41.000 +0800,2022-10-21 15:41:05.967 +0800,"15WS02 Fines Chute Blockage",RCA126 - 15WS02 Fines Chute Blockage Historical Sharepoint CC Id 126,Medium,2,2022-01-04 16:00:00.000 +0800,2022-10-28 00:00:00.000 +0800,5,CCK-P1-WSCR-SCRUB2-WS102 -CHUT2,Liners Scrubber Discharge Fines Chute,Liner,PM-CHTS,'{}',Chute,Blockage,6187,1,3,4.6,12880.0,2022-08-01 08:00:00.000 +0800,,,,,
10469,2022-08-04 11:29:15.053 +0800,2022-10-19 10:41:01.075 +0800,NFP84 under performance on install ,NFP84 wet end under-performed immediately on install and had to be replaced after 18 days since installation,Medium,2,2022-05-29 10:00:00.000 +0800,2022-09-01 00:00:00.000 +0800,6,CLB-UT-WTRS-NORBFD-NFP083,Motor Bore Pump MOT069,Electrical Motor,PM-MTRS,'{}',Cowling,Broken,2,1,1,0.0,0.0,,0.0,,true,2,2022-10-19 10:41:01.075 +0800
1252,2021-11-02 07:40:53.000 +0800,2022-10-21 16:24:36.333 +0800,"15WS01 Scrubber Water Addition Blockage ",RCA117-15WS01 Scrubber Water Addition Blockage Historical Sharepoint CC Id 117,Medium,2,2021-10-31 16:00:00.000 +0800,2022-10-28 00:00:00.000 +0800,5,CCK-P1-WSCR-SCRUB1-WS101 -ASBLY,Scrubber 15WS01,Scrubber,PMGENERAL,"'{""PMGENERAL"",""PM-STRC"",""PM-SCBR""}'",Whole Unit,Blockage,14144,1,3,5.6,20000.0,2022-08-01 08:00:00.000 +0800,,,,,
1240,2021-09-01 04:57:40.000 +0800,2022-10-21 16:54:26.765 +0800,"10RW202 pump failure (RCH off)",RCA102 - 10RW202 pump failure (RCH off) Historical Sharepoint CC Id 102,Medium,2,2021-08-30 16:00:00.000 +0800,2022-10-28 00:00:00.000 +0800,5,CCK-P2-RMIN-COMM10-RW202 -DRIV1,Drive V-Belt System Pump 10RW202,Drive,PMGENERAL,"'{""PM-STRC"",""PM-MTRS"",""PMGENERAL"",""PM-SDS"",""PM-FILT"",""PM-CONV"",""PM-SAMP"",""PM-BRGSL"",""PM-VSD"",""MP-TPDRV"",""PM-WTRS"",""PM-FDR"",""MP-FDRVE"",""PM-ELCO"",""MP-DRSHT"",""MP-DRTRN"",""MP-SPRKT"",""PM-DRSHT"",""MP-HDMTR"",""PM-CRNE"",""PM-PMP"",""PM-GEAR"",""PM-PWPK"",""PM-CRSH""}'",Pump,Leaking,14144,1,3,5.2,0.0,2022-08-01 08:00:00.000 +0800,,,,,
10610,2022-10-22 13:44:02.670 +0800,2022-10-22 14:03:46.973 +0800,DR055 Engine Fire Incident,"On the 21/10/2022 at about 08:45am, smoke was spotted on DR055 non-drill end.
Drill controller was contacted, drill was shut down and handheld fire extinguisher was used on the smoke.
Initial investigation revealed that a high-pressure fuel hose had leaked causing the smoke. ",High,2,2022-10-21 08:45:00.000 +0800,2022-10-21 08:00:00.000 +0800,3,CLB-MP-DRLL-DR055 -ENGINE-FUSYS-FUHLF,Fuel System Hoses Lines & Fittings,Hose,MP-PIPNG,'{}',Hose,Burst,7921,2,1,0.0,0.0,,0.0,,false,,
830,2019-12-23 04:50:30.000 +0800,2021-06-24 00:22:54.000 +0800,GEHO Maintenance Strategy Review; Historical Sharepoint Solomon Id 326,,Medium,3,2019-12-22 16:00:00.000 +0800,,5,SOL-KV,Unknown,Unknown,PMGENERAL,'{}',,,8416,1,3,0.0,1.0,2022-08-01 08:00:00.000 +0800,,,,,
10611,2022-10-23 12:34:04.812 +0800,2022-10-27 08:43:35.835 +0800,Hopper 10 Grizzly Screen Failure,Grizzly cassette hold down bolts loose,Medium,3,2022-10-22 07:27:55.000 +0800,2022-11-20 00:00:00.000 +0800,3,CLB-PP-RMIN-CRSH10-SN010 -ASBLY,Screen Wear Components SN010,Assembly,PMGENERAL,"'{""PM-WTRS"",""PM-STRC"",""PM-CHTS"",""PM-ELPR"",""PM-IDLR"",""MP-CABOP"",""PM-EXHST"",""PM-ENGIN"",""PMGENERAL"",""PM-SAMP"",""PM-ELESY"",""MP-RKBKR"",""PM-CRSH"",""PM-FILT"",""PM-ELCO"",""PM-CRNE""}'",Bolt,Broken,540,1,3,3.4,30798.9,2022-10-27 08:00:00.000 +0800,9.7,,false,,
1416,2020-07-23 08:46:33.000 +0800,2020-08-15 23:16:23.000 +0800,RCA661 - SN226 Panel Failure; Historical Sharepoint CB Id: 74,,Medium,2,2020-07-20 16:00:00.000 +0800,,5,CLB-PP-WSCR-MOD216-SN226 -ASBLY,Screen Body Assembly SN226,Screen,PM-STRC,'{}',,,1302,1,3,1.76666666666667,9600.0,2022-08-01 08:00:00.000 +0800,,,,,
10612,2022-10-24 06:25:07.608 +0800,2022-10-24 07:05:26.322 +0800,EX106 LH Engine Excessive Blow by ,During daily service service tech noticed oil blowing out from the fill caps of LH engine right hand bank. Further investigated with the maintenance team finding ECM recording excess blowby faults which was confirmed with visual observation. No obvious signs of component failure. ,Medium,2,2022-10-23 02:26:00.000 +0800,2022-11-21 00:00:00.000 +0800,3,CCK-MP-EXCV-EX106 -LHENGN,Engine Assembly Cummins QSK45,Engine,MP-ENGIN,'{}',Piston,Excessive Smoke,6641,2,1,0.0,0.0,,0.0,,false,,
1356,2021-02-11 23:56:30.000 +0800,2021-04-21 01:14:31.000 +0800,RCA704 - CV006 TF410B Transformer Failure; Historical Sharepoint CB Id: 109,,Medium,2,2021-02-06 16:00:00.000 +0800,,5,CLB-PP-RMIN-CONVEY-CV006 -EICON,Local Control Systems CV006,Local Control Stn,PMGENERAL,'{}',,,1155,1,3,13.4833333333333,70000.0,2022-08-01 08:00:00.000 +0800,,,,,
1254,2021-12-19 07:34:09.000 +0800,2022-10-24 12:20:31.266 +0800,"10CV201A failed tail pulley","unplanned mechanical inspection, possibly counterweight damage after retrieving metal of the conveyor last night. This has reduced secondary crushing capacity. Causing infeed to constraint and gold feeders due to secondary bin levels
RCA097",Medium,1,2021-08-05 16:00:00.000 +0800,2022-10-31 00:00:00.000 +0800,1,CCK-P1-CRSH-CRUSH2-CR102 -ASBLY,Counter Weight Assembly 20CR02,Crusher – Cone,PMGENERAL,'{}',Whole Unit,"Broken (Cracked,Leaking,Holed)",6187,1,1,3.5,10500.0,,,,,,
1307,2021-11-23 07:29:26.000 +0800,2021-11-25 06:53:38.000 +0800,RCA752 - CV112 PY06 Locking Assembly Failure; Historical Sharepoint CB Id: 153,,Medium,1,2021-11-20 16:00:00.000 +0800,,5,CLB-PP-TRLO-CNV001-CV112 -ASBLY,Pulley 2200 LT Bend 6 CV112,Pulley,PM-PLYS,'{}',,,540,1,3,5.25,104018.0,2022-08-01 08:00:00.000 +0800,,,,,
1441,2022-04-10 04:46:53.000 +0800,2022-08-29 15:41:12.659 +0800,CV010 Brake Failure,RCA766 - CV010 Brake Failure; Historical Sharepoint CB Id: 165,Medium,2,2022-04-08 16:00:00.000 +0800,2022-09-26 00:00:00.000 +0800,3,CLB-PP-RMIN-CONVEY-CV010 -DRIV1,Brake LHS CV010,Brake Assembly,PM-BRK,'{}',Brake Pad,Broken,8000,1,3,3.7,13100.0,2022-06-15 08:00:00.000 +0800,,,,,
1390,2021-11-29 09:51:33.000 +0800,2022-01-03 05:24:39.000 +0800,RCA753 - AF007 Chain Link Failure; Historical Sharepoint CB Id: 154,,Medium,2,2021-11-28 16:00:00.000 +0800,,5,CLB-PP-RMIN-CRUSH7-AF007 -ASBLY,Structure AF007,Apron Feeder,PM-STRC,'{}',,,8000,1,3,3.4,0.0,2022-08-01 08:00:00.000 +0800,,,,,
1293,2021-11-30 01:14:00.000 +0800,2021-12-13 09:51:49.000 +0800,RCA754 - Loading of train ID 214977 failure; Historical Sharepoint CB Id: 155,,Medium,1,2021-11-27 16:00:00.000 +0800,,5,CLB-PP-TRLO,Unknown,Unknown,PMGENERAL,'{}',,,540,1,3,8.75,0.0,2022-08-01 08:00:00.000 +0800,,,,,
1303,2021-12-19 23:57:01.000 +0800,2021-12-21 05:57:40.000 +0800,RCA756 - SH105 Encoder Failure; Historical Sharepoint CB Id: 157,,Medium,1,2021-12-18 16:00:00.000 +0800,,5,CLB-PP-CRSH-SHT001-SH105 -EICON,Encoder SH105,Position Switch,PMGENERAL,'{}',,,9093,1,3,5.88333333333333,31900.0,2022-08-01 08:00:00.000 +0800,,,,,
10613,2022-10-24 15:06:16.655 +0800,2022-10-24 15:19:01.930 +0800,VF205 Feed Chute Structure Damage,"At approx. 13:00 on 21/09/2022, damage was found on VF205 feed chute.
The east wall of the feed chute had pulled away from the side walls and began cracking.
Knife gate closed and ran VF205 to clean. Build up fell off from the feed chute was observed.
Welding repairs were completed on the chute and VF205 returned to service.
",Low,3,2022-09-21 13:00:00.000 +0800,2022-12-31 08:00:00.000 +0800,3,CLB-PP-SSCR-MOD205-VF205 -CH001,Chute/Hood Feed CH205A VF205,Chute,PM-CHTS,'{}',Chute,Damaged,540,1,1,0.0,0.0,,0.0,,false,,
10507,2022-08-26 08:28:05.117 +0800,2022-10-25 10:29:10.472 +0800,TLO SC531 Sample Cutter Failure,"Sampling bucket found with with worn through weld seams risking the integrity of the cutter
Sample bucket was found to be 10kg underweight when weighed at the Metlab",Medium,1,2022-08-23 05:38:00.000 +0800,2022-09-23 00:00:00.000 +0800,3,CLB-PP-TRLO-MOD530-SC531 -ASBLY,Cutter Primary Sample SC531,Sample Cutter,PM-SAMP,'{}',Carriage Assembly,Worn,540,1,1,0.0,0.0,,0.0,,,,
560,2018-04-13 05:13:55.000 +0800,2018-04-13 05:14:56.000 +0800,Geho PU525 failure; Historical Sharepoint Solomon Id 51,,Medium,3,2017-02-14 16:00:00.000 +0800,,5,SOL-KV-DSND-THICK1-PU525 -ASBLY,Pump Tailings Disposal PU525,Pump,PM-PMP,'{}',,,14090,1,3,0.0,0.0,2022-08-01 08:00:00.000 +0800,,,,,
561,2018-04-13 05:14:28.000 +0800,2018-04-13 05:14:28.000 +0800,CV705 Drive 3 Lube Pump Failure; Historical Sharepoint Solomon Id 52,,Medium,3,2017-02-14 16:00:00.000 +0800,,5,SOL-KV-CNVY-CONVEY-CV705 -DRIV3,Lube Unit Gearbox 3 CV705,Pump,PM-GEAR,'{}',,,217,1,3,0.0,0.0,2022-08-01 08:00:00.000 +0800,,,,,
562,2018-04-13 05:14:43.000 +0800,2018-04-13 05:14:43.000 +0800,CV801 contactor relay fault; Historical Sharepoint Solomon Id 53,,Medium,3,2017-02-17 16:00:00.000 +0800,,5,SOL-SY-CNVY-CONVEY-CV801 -EICON,Electrical Field Devices CV801,Electrical System,PMGENERAL,'{}',,,217,1,3,0.0,0.0,2022-08-01 08:00:00.000 +0800,,,,,
563,2018-04-13 05:14:43.000 +0800,2018-04-13 05:15:05.000 +0800,CV113 & CV123 Weba Chutes Blocking; Historical Sharepoint Solomon Id 54,,Medium,3,2017-02-25 16:00:00.000 +0800,,5,SOL-KV-RMIN-CONVEY-CV113 -CH118,Head Chute CH118,Chute,PMGENERAL,'{}',,,14170,1,3,0.0,0.0,2022-08-01 08:00:00.000 +0800,,,,,
565,2018-04-13 05:14:44.000 +0800,2018-04-13 05:15:11.000 +0800,SN204 Coupling failure; Historical Sharepoint Solomon Id 56,,Medium,3,2017-02-28 16:00:00.000 +0800,,5,SOL-KV-WSCR-SCRUB1-SN204 -DRIV1,Exciter DE Wet Screen Drive SN204-EX01,Exciter,PM-EXTR,'{}',,,14090,1,3,0.0,0.0,2022-08-01 08:00:00.000 +0800,,,,,
195,2021-10-19 10:04:00.000 +0800,2022-06-12 14:40:59.000 +0800,"7101 Engine Damage; Historical BMS Id: RCA-0000497",During the weekly 3hr inspection the maintainer picked up that alt aux drive bearing had failed. They consequently checked the oil filters and found an excessive amount of metal in them.,Medium,2,2021-10-17 13:15:00.000 +0800,2022-06-12 14:40:59.000 +0800,5,SOL-MP-EXCV-EX7101-ENGINE,Engine Assembly Cummins QSK50,Engine,MP-ENGIN,'{}',,,9974,1,3,155.0,0.0,2022-06-12 14:40:59.000 +0800,,,,,
566,2018-04-13 05:14:45.000 +0800,2018-04-13 05:15:14.000 +0800,SZ121 jammed with AF121-CH121 liner dropping; Historical Sharepoint Solomon Id 57,,Medium,2,2017-03-10 16:00:00.000 +0800,,5,SOL-KV-RMIN-CRUSH2-AF121 -CH121,Chute Discharge CH121,Chute,PM-CHTS,'{}',,,14170,1,3,0.0,0.0,2022-08-01 08:00:00.000 +0800,,,,,
196,2021-04-13 07:55:00.000 +0800,2022-05-31 14:19:30.000 +0800,EX8101 Turbo failure - PP1 Pos2; Historical BMS Id: RCA-0000429,"EX8101 was put into breakdown for blowing black smoke from PP1 exhaust running rich due to insufficient airflow. Bearing has failed, shaft is difficult to rotate and impeller blades have contacted the housing. No axial bearing play, but significant lateral movement, allowing impeller to contact.",Medium,1,2021-04-08 06:47:00.000 +0800,2022-05-31 14:19:30.000 +0800,5,SOL-MP-EXCV-EX8101-FRENGN-ENGIN-TBOP2,Turbocharger Front Pos 2,Turbocharger,MP-TBOCG,'{}',,,9974,1,3,17.0,0.0,2022-05-31 14:19:30.000 +0800,,,,,
197,2021-09-05 09:37:00.000 +0800,2021-10-17 11:43:59.000 +0800,EX7101 Failed Engine - September 2021; Historical BMS Id: RCA-0000487,Machine stopped for high blowby. Original diagnosis found a failed RH HP Turbo. Whilst arranging turbo replacement noticed there was coolant present in the sump. Further investigating found #4 Pot has a cracked liner and dropped exhaust valve.,Medium,2,2021-09-02 12:27:00.000 +0800,2021-10-17 11:43:59.000 +0800,5,SOL-MP-EXCV-EX7101-ENGINE,Engine Assembly Cummins QSK50,Engine,MP-ENGIN,'{}',,,9974,1,3,147.25,0.0,2021-10-17 11:43:59.000 +0800,,,,,
198,2021-05-28 15:04:00.000 +0800,2022-05-31 11:42:05.000 +0800,Swing Pump Secondary Pressure Limiting Valve Body Crack; Historical BMS Id: RCA-0000452,Breakdown reported for oil leak.,Medium,1,2021-05-23 11:28:00.000 +0800,2022-05-31 11:42:05.000 +0800,5,SOL-MP-EXCV-EX8101-HYDSYS-HYPP1-SWPP1,Hyd Pump Swing LH Front,Hydraulic Pump,MP-HDPMP,'{}',,,9974,1,3,0.0,0.0,2022-05-31 11:42:05.000 +0800,,,,,
567,2018-04-13 05:14:45.000 +0800,2018-04-19 02:05:46.000 +0800,"CRC30X HE anodes failure, Pl refer to RCA16093; Historical Sharepoint Solomon Id 58",,Medium,2,2017-03-11 16:00:00.000 +0800,,5,SOL-FT-CRSH-CRUSH1,Unknown,Unknown,PMGENERAL,'{}',,,14090,1,3,0.0,0.0,2022-08-01 08:00:00.000 +0800,,,,,
199,2021-12-12 14:56:00.000 +0800,2022-06-10 10:09:34.000 +0800,EX8101 PP1 Fan Hub Failure; Historical BMS Id: RCA-0000509,EX8101 PP1 fan hub failed causing the fan to impact the radiator.,Medium,2,2021-12-12 01:08:00.000 +0800,2022-06-10 10:09:34.000 +0800,5,SOL-MP-EXCV-EX8101-FRENGN-COSYS-BELTS,Engine Belts & Idler Pulleys,Drive Belts & Pulley,MP-BLTEN,'{}',,,9974,1,3,97.21,0.0,2022-06-10 10:09:34.000 +0800,,,,,
573,2018-04-13 05:14:49.000 +0800,2018-04-13 05:15:59.000 +0800,CV202 belt damage from oversize rock; Historical Sharepoint Solomon Id 64,,Medium,3,2017-04-03 16:00:00.000 +0800,,5,SOL-KV-WSCR-SCRUB2-CV202 -ASBLY,Belt Conveyor CV202,Conveyor Belting,PM-CVBT,'{}',,,14170,1,3,0.0,0.0,2022-08-01 08:00:00.000 +0800,,,,,
200,2019-12-03 10:31:00.000 +0800,2020-02-21 15:05:21.000 +0800,DR204 Auxiliary Feed Pump Failure ; Historical BMS Id: RCA-0000230,"When conducting fault diagnostics on overheating issues, it was found the feed pump was over pressurising and would not stroke back. ",Medium,2,2019-11-30 04:44:00.000 +0800,2020-02-21 15:05:21.000 +0800,5,CCK-MP-DRLL-DR204 -HYDSYS-HYDPP-MNPP3,Auxillary Feed Open Loop Pump,Hydraulic Pump,MP-HDPMP,'{}',,,2849,1,3,27.0,0.0,2020-02-21 15:05:21.000 +0800,,,,,
202,2022-06-05 14:23:00.000 +0800,2022-06-05 16:05:30.000 +0800,MD6310 Hoist and Pulldown Cables not achieving strategy life; Historical BMS Id: RCA-0000550,"Hoist and pulldown cables on all MD6310 drill rigs at CC are currently not achieving strategy life of 6,000 hours, failing as early as 700 hours. Average life achieved is 1,800 hours across all cables on the MD6310 drills (DR2112 and DR2113).",Medium,2,2022-05-27 15:16:00.000 +0800,2022-06-05 16:05:30.000 +0800,5,CCK-MP-DRLL-DR2112-STRUCT-DMAST,Mast,Mast,MP-MBOOM,'{}',,,3454,1,3,0.0,0.0,2022-06-05 16:05:30.000 +0800,,,,,
574,2018-04-13 05:14:50.000 +0800,2018-04-13 05:16:03.000 +0800,ROM Bin Rockbox failure on to AF121; Historical Sharepoint Solomon Id 65,,Medium,3,2017-04-09 16:00:00.000 +0800,,5,SOL-KV-RMIN-CRUSH2-AF121 -ASBLY,Apron Feeder AF121,Apron Feeder,PM-STRC,'{}',,,14170,1,3,0.0,0.0,2022-08-01 08:00:00.000 +0800,,,,,
203,2020-01-26 07:52:00.000 +0800,2020-07-02 16:49:10.000 +0800,DT224 High brake temperature Breakdown ; Historical BMS Id: RCA-0000244,"From beginning of August onwards DT224 flagging high brake temperature event and high TC out temperature events . Machine had 210 hrs of combined down time due to this issue . Conducted diagnostic and repair several time , but this issue not resolved . This RCA is focusing on identify the actual root caused of the issue to   prevent the re-ocurrence.   ",Medium,1,2020-01-26 07:52:00.000 +0800,2020-07-02 16:49:10.000 +0800,5,CLB-MP-HAUL-DT224 -BRKSYS,Braking System,Brake System,MP-BKSYS,'{}',,,10407,1,3,210.0,0.0,2020-07-02 16:49:10.000 +0800,,,,,
